manga_id,title,type,status,latest_update,score,scored_by,synopsis
28393,Sakamichi no Apollon,Manga,Finished,2012-01-28T00:00:00+00:00,8.49,11915,"Constantly transferring schools since childhood, Kaoru Nishimi has always been seen as a social outcast when he transfers due to his intellectual nature and wealthy background. But after moving to Kyushu for his first year of high school, things begin to change. Kaoru befriends the class president, Ritsuko Mukae, and, unexpectedly, the notorious school delinquent, Sentarou Kawabuchi. While Kaoru is an honors student, Sentarou is constantly getting into fights and skipping class. However, these two opposites find a common ground in one thing—music.

One day, Kaoru is invited by Ritsuko to visit her family's record store, where he finds Sentarou in the basement showcasing his skill in jazz drumming. Kaoru, being a classical pianist, knows nothing about jazz. But inspired by the performance, he begins to open his mind to the genre alongside Sentarou. The duo begin to practice in after-school jazz sessions in the record store's basement. As he spends more time improving his skills in jazz, Kaoru finds a person whom he can truly call his friend and comes to learn the joys of playing music.

[Written by MAL Rewrite]"
128463,Uruwashi no Yoi no Tsuki,Manga,Publishing,,8,7297,"Every time Yoi Takiguchi so much as lets out a sigh, her female classmates squeal in admiration and awe. She has been dubbed the school's ""prince"" by virtue of her boyishly attractive appearance and casual disposition. However, she chooses to be indifferent toward the attention she receives and spends her days normally—that is, until the school's other prince, Kohaku Ichimura, waltzes into her life and calls her beautiful.

Kohaku is nothing like a prince—he acts thoughtlessly and does as he pleases. But when he compliments her, Yoi feels flustered, and the way he looks at her gets her all nervous. He is the first boy to acknowledge her as a girl, and her attempts to distance herself prove futile as he seems to have set his sights on her. While Yoi keeps telling herself that it is nothing serious, even she cannot completely ignore the stir Kohaku causes in her heart.

[Written by MAL Rewrite]"
1896,Akuma to Love Song,Manga,Finished,2011-04-05T00:00:00+00:00,7.62,12951,"Maria Kawai transfers from St. Katria Girls' School to Touzuka Public High School, and her arrival sparks interest for two reasons: St. Katria has an excellent academic reputation compared to Touzuka, and Maria is incredibly cute! When her classmates speculate upon her transfer to their less-than-impressive school, she flatly informs them that she was expelled for violence against her former teacher. This is characteristic of Maria—despite her angelic appearance, she will tell the unadorned truth regardless of social niceties, and as such, people often compare her to a devil.

On her first day, Maria is introduced to Yuusuke Kanda and Shin Meguro, two unlikely friends. Yuusuke pretends to be cheerful and fun-loving, but in reality, he is uninterested in many things and people. In contrast, Shin acts cold and distant, but can secretly be quite caring. 

Yuusuke proposes to Maria that she should put a ""lovely spin"" on the things she says to make her words sound less harsh, even if her message remains the same. Unfortunately, Maria cannot master this ""lovely spin"" when speaking, but people seem to be touched by her voice when she sings. Can singing help Maria convey that she is lonely, that she wants to be liked by others—and most of all—that she wants to be able to like herself?

[Written by MAL Rewrite]"
54817,Kanojo ni Naru Hi,Manga,Finished,2017-03-03T00:00:00+00:00,7.32,14852,"Childhood best friends Nao Mamiya and Kyousuke Miyoshi have always competed against each other, whether in academics and sports or trivial day-to-day things. Despite Nao winning every time, Kyousuke refuses to give up, hoping to defeat him in the future.

One day, however, at the age of 17, Nao is struck by a sudden illness and is hospitalized for several weeks, only to return as an ""emerged"" female. Much to the dismay of Kyousuke who is afraid of women, Nao easily accepts the situation and is ready to continue living life as a girl.

In a world where a gender shifting mechanism maintains a fixed male-to-female ratio, Kanojo ni Naru Hi is the tale of Nao as a boy who has switched genders, adapting to the change in his circumstances.

[Written by MAL Rewrite]"
696,Hayate no Gotoku!,Manga,Finished,2017-04-12T00:00:00+00:00,7.84,14255,"Misfortunes abound in the life of 16-year-old Hayate Ayasaki. Even though he is underage, he spends most of his time working part-time jobs to make money to support his extravagant parents. As if that wasn't hard enough, his parents disappear without a trace one day, leaving him behind with a debt of almost 150 million yen. As a result, he finds himself being chased by debt collectors.

Running for his life, he stops in a park, believing that he is safe. Contemplating his jobless future, he decides to kidnap a wealthy child for ransom. And thus, when he sees a rich-looking blonde girl, he attempts to capture her. However, she too is kidnapped before Hayate can even try!

Hayate then saves her, and as a reward, he requests a job, and the girl makes him her butler, revealing herself to be the daughter of a wealthy family. Even with a job, his misfortune remains; Hayate will have to go through many nasty predicaments, all the while burdened by his lousy luck.

[Written by MAL Rewrite]"
8456,½ Prince,Manhua,Finished,2014-07-02T00:00:00+00:00,7.87,15492,"When Feng Lan's brother encouraged her to play the virtual reality game Second Life, he told her that as a girl, she'd be doted upon. To prove that she could be a better player than him even without a handicap, she was granted her special request for a male avatar. Her adventures in this online RPG begin, as she discovers both the game and what it's like to be thought of as a boy."
111621,Pashiri na Boku to Koisuru Banchou-san,Manga,Finished,2021-01-21T00:00:00+00:00,7.14,14226,"One could describe Fuyuhiko Unoki as a weakling. From elementary to middle school, he was constantly bullied by his peers. He has now entered high school, and yet this has not changed. One day, the school's top delinquent, Kanade Toramaru, calls him out, and she immediately declares ownership over him.

His high school days will now be full of fear, as he spends them as Kanade's personal errand boy. However, one big misunderstanding between Fuyuhiko and Kanade remains: Kanade believes that the two of them are dating. Her confession of love is misinterpreted by him, leaving her blissfully unaware of Fuyuhiko's dread for her.

While this misunderstanding stays neglected, Fuyuhiko and Kanade become ever closer, slowly pushing this imaginary romance on the verge of turning into a real one.

[Written by MAL Rewrite]"
89217,"Omoi, Omoware, Furi, Furare",Manga,Finished,2019-05-13T00:00:00+00:00,7.73,11175,"The story centers around Yuna and Akari who have two very different views of love: Yuna is someone who sees love as a dream and Akari is someone who is very realistic about her romance choices. Meanwhile, there are two boys, Kazuomi and Rio, who also have different views of love: Kazuomi's an airhead and doesn't understand the concept of love, while Rio grabs the opportunity when confessed to as long as the girl looks cute.

(Source: MAL News)"
119152,Lv2 kara Cheat datta Motoyuusha Kouho no Mattari Isekai Life,Manga,Publishing,,7.14,9476,"Banaza, a humble merchant, is summoned to another world as a hero candidate, in the hopes that he has what it takes to defeat the demon army. When his summoners discover that he possesses no special skills, Banaza is summarily dismissed...but something goes wrong, and he can't go back home. Now he must find a way to survive in this new kingdom. Luckily, Banaza might be more powerful than anyone–including Banaza himself–realized!

(Source: Seven Seas Entertainment)"
32779,Denpa Kyoushi,Manga,Finished,2017-03-29T00:00:00+00:00,7.63,11344,"Kagami Junichirou was known as a physics genius when he was a teenager, and he was even published in ""Nature."" However, after college, he suddenly lost all interest in science. As a NEET, he's devoted himself to his anime blog and nerdy collecting habits. He claims he has a serious illness called ""I can't do anything I don't want to do."" Desperate to get him to do something with his life, his little sister manages to get him a job teaching physics at his old high school. He's certainly an unconventional teacher, but he becomes fairly popular with the students. After helping a girl who's being ruthlessly bullied, Kagami finds that he actually likes teaching. Will he continue his career as a weird teacher? Will he go back into physics? Or will he end up back where he started?

(Source: MangaHelpers)"
22986,Ran to Haiiro no Sekai,Manga,Finished,2015-04-15T00:00:00+00:00,8.03,8357,"Aspiring little sorceress Ran Uruma feels frustrated as she frantically searches for her favorite pair of shoes. Despite her being just an elementary school child, those particular shoes allow her to transform into the body of an adult. Ran teems with magical potential but has yet to learn how to control it. Knowing this, her beast sorcerer brother, Jin, hides the shoes until she completes cleaning their house.

Ran's mother, Shizuka, is one of the most powerful sorceresses to exist and must live far from home to look after the city. Head of their family and all sorcerers, Zen is also often away attending business and has to leave Jin in charge of the household. Ran can be quite difficult to handle, and only a single pair of eyes is not enough to keep tabs on her every mischief. With the freedom she gets while no one is restricting her, Ran explores the magical abilities that drive her toward many fascinating adventures.

[Written by MAL Rewrite]"
149334,Tokidoki Bosotto Russia-go de Dereru Tonari no Alya-san,Manga,Publishing,,7.64,9610,"Masachika Kuze, an unmotivated first-year student attending the prestigious Seirei Academy, mostly spends his time playing gacha games or dozing off during lectures. Despite his reputation as an undisciplined loafer, he attracts the interest of Alisa Mikhailovna ""Alya"" Kujou, the esteemed ""solitary princess"" who sits next to him in class.

Alya is deeply revered by her peers, and she captivates people everywhere she goes thanks to her entrancing looks and impeccable conduct. However, the beautiful half-Russian, half-Japanese girl has an adorable secret: while she constantly berates Masachika for his lax behavior, she conceals her true feelings with affectionate and flirtatious remarks in Russian.

Unbeknownst to Alya, Masachika picks up every single one of her comments—for he is fluent in Russian! Bewildered by her enigmatic actions, Masachika decides to act clueless and play along, sparking an unconventional and heartwarming relationship with the charming girl.

[Written by MAL Rewrite]"
118803,Fetiple,Manga,Finished,2021-09-25T00:00:00+00:00,7.42,11250,"After a night of reckless drinking, Tatsu Yunoki wakes up and finds a mysterious girl sleeping next to him. Recalling the alcohol-induced craziness of the previous night, Tatsu realizes that he had confessed to the girl called Kotoka Hatsushima about his hair fetish and she had unabashedly done the same—except in her case, it was a back fetish. This leads to the duo living together as their desired lifestyles turn into reality.

Fetiple follows the story of these two oddballs connected by their weird fetishes for each other, as their personalities lead to amusing day-to-day activities.

[Written by MAL Rewrite]"
102997,"Saotome Senshu, Hitakakusu",Manga,Finished,2019-10-21T00:00:00+00:00,7.47,12546,"Satoru Tsukishima has just been confessed to by fellow high school boxing club member Yae Saotome, who is currently the Kanto region's Female Featherweight Champion. Overjoyed at first, Satoru isn't able to accept her feelings as he believes that she should be focusing on boxing instead. Yae's championship will soon be on the line, and the entire school is counting on her to someday represent Tokyo in the Olympics. It also doesn't help that he's nowhere near as skilled as she is, conflicted by the thought of a rising star being in a relationship with someone as average as him.

But when their coach finds out about the confession, Satoru is assigned as Yae's trainer so the two can secretly date and spend more time together while also engaging in club activities. However, if anyone finds out about the two, it will mean the end of their relationship. With this in mind, their pure and awkward romance begins!

[Written by MAL Rewrite]"
70399,Seishun Buta Yarou Series,Light Novel,Finished,2024-10-10T00:00:00+00:00,8.62,7315,"One day, in the library where Sakuta Azusagawa studies, he runs into an unexpected sight: a beautiful high school girl in a bunny outfit. She turns out to be Mai Sakurajima, a famous former actress and fellow student at Minegahara High. His surprise at seeing Mai wear such risqué attire in the library, however, is nothing compared to the shocking realization that he is the only one who can see her!

Reminded of an event from his past, Sakuta offers to help Mai discover the reason behind her invisibility. Despite their initially contentious relationship, the two quickly become close: Mai and Sakuta learn to appreciate each other, and their friendship turns into a budding romance. This further fuels their determination to solve Mai's dilemma.

While the investigation progresses, Sakuta attributes Mai's situation to an urban legend known as Adolescence Syndrome: strange phenomena occurring in youth, unexplained by science and often dismissed as delusion. With few promising results, Mai's predicament worsens to the point where being unseen is the least of her worries. Can Sakuta and Mai solve the mystery of her Adolescence Syndrome before she disappears completely?

[Written by MAL Rewrite]"
119082,Koori Zokusei Danshi to Cool na Douryou Joshi,Manga,Publishing,,7.67,7232,"Himuro is an office worker who belongs to a race of supernatural beings with strange powers. Whenever he is deep in concentration, he subconsciously plunges his poor coworkers into a close rendition of the Arctic. Even so, contrary to his icy powers, Himuro is a warm and kind person. He likes flowers and cats, but alas, he cannot get too close to either.

Himuro has a soft spot for his colleague Fuyutsuki, a calm woman who has a knack for providing simple solutions to his unconventional problems. Whenever Fuyutsuki does something for him, a snowstorm of emotions builds inside Himuro's heart, and he fails to notice the raging snowstorm he causes on the office floor.

Thanks to his snowy tantrums, Himuro's feelings are apparent to everyone but Fuyutsuki. However, fueled by immense adoration and desire, Himuro is prepared to do whatever it takes to capture her heart.

[Written by MAL Rewrite]"
125717,Okaeri Alice,Manga,Finished,2023-08-09T00:00:00+00:00,7.13,13420,"Childhood friends Youhei, Kei, and Yui are reunited in high school. But what seemed like a straightforward love triangle between the three of them takes an unexpected turn when Kei shows up looking and dressed like a girl.

In this story of adolescent awakening, perversion, and love, Oshimi sets out to explore the boundaries of gender, sexuality, and identity.

(Source: Kodansha USA)"
5113,Witch Hunter,Manhwa,Publishing,,7.75,10371,"Witches suddenly declare war against humans, causing two-thirds of the world to fall apart. They summon monsters called ""Supporters"" and devastate human residences... but why?

Survivors gather people with the power to combat the witches and called them Witch Hunters! Tasha Godspell is one of the strongest nicknamed ""The Marksman"" along with his ""Jack-O-Lantern"" looking Supporter. He fights the witches but cannot really bring himself to hate them...

(Source: MU)"
101711,Mousou Telepathy,Manga,Finished,2020-04-12T00:00:00+00:00,7.47,14273,"One would think that the ability to read minds would be incredible, but for Ayako Nakano, it is an involuntary power she wishes she never had. Being exposed to the harsh thoughts of others is one thing, but knowing what people want of her has made it difficult to act on her free will. Having quickly learned that revealing her power would alienate her from her peers, she keeps her abilities a secret, deciding that it is better to stay isolated and keep them hidden. Gloomy and friendless as a result of her power, Nakano is set to begin her final year of high school alone, as always.

This changes when she meets Hayato Toda. Though virtually expressionless, Toda is a popular student, and Nakano is puzzled to discover that he has an intense crush on her. Yet, his thoughts reveal something more: he has lewd, perverted fantasies of her nearly every minute of the day, which Nakano now has to suffer through on a daily basis. Even so, Nakano soon finds herself becoming a part of his group of friends, thrusting her into her very first foray into friendship and romance.

[Written MAL Rewrite]"
585,Hourou Musuko,Manga,Finished,2013-07-12T00:00:00+00:00,8.2,9571,"Shuuichi Nitori is a 5th grade student who likes to bake and has always been something of a feminine boy. When he transfers to a new school, Shuuichi is mistaken for his 6th grade sister on his first day. Then he ends up sitting next to Yoshino Takatsuki, a tall, boyish girl who everyone calls ""Takatsuki-kun."" They both have secrets they can't let anyone know...

The series deals with issues such as being transgender, gender identity, and the beginning of puberty.

(Source: Kotonoha, edited)"
729,Emma,Manga,Finished,2008-02-12T00:00:00+00:00,8.13,11452,"It's the turn of the 20th century, and Victorian era England plays host to a poignant and emotional saga of love between two individuals of thoroughly different societal standing. Working class maid Emma and  wealthy aristocrat William Jones find themselves falling for one another despite their allotted positions in life, and it is their persistent efforts to traverse the dangerous minefields of wealth, power, and staunch tradition, that provides the gripping emotional drama of Kaoru Mori's Emma. The rigid social structures of the time and the disapproving elite, including but not limited to William's own family, seek to keep the lovestruck pair apart due to their heavy condemnation of this breach of proper conduct. But despite their best attempts to resist one another, William and Emma's relationship deepens, and their feelings for one another prove to be stronger than the harshest of judgments.

From the author of the acclaimed series Otoyomegatari, comes this impassioned tour de force of two individuals who strive to never give up on their love. But will William and Emma's relationship fall prey to the slew of unforeseen ordeals that rise up to challenge it, or will they get their happy ending after all?

[Written by MAL Rewrite]"
160,School Rumble,Manga,Finished,2008-07-23T00:00:00+00:00,7.97,14291,"She...is a second-year high school student with a single all-consuming question: Will the boy she likes ever really notice her? He...is the school's most notorious juvenile delinquent and he's suddenly come to a shocking realization: He's got a huge crush, and now he must tell her how he feels. Life-changing obsessions, colossal foul-ups, grand schemes, deep-seated anxieties, and raging hormones—School Rumble portrays high school as it really is: over-the-top comedy!

(Source: Kodansha USA)"
34127,Mahouka Koukou no Rettousei,Light Novel,Finished,2020-09-10T00:00:00+00:00,8.15,9624,"The year is 2095. Magic has been tamed as another form of technology, and the practice of magic is now a rigorous discipline. Brother and sister Tatsuya and Miyuki Shiba are just about to start their first year at the renowned First Magic High School of Japan. But the school's ironclad rules mean that the brilliant Miyuki enters the prestigious Course 1, while her older brother, Tatsuya, is relegated to Course 2—and that's just the beginning of their troubles!

(Source: Yen Press)"
70061,Rakudai Kishi no Cavalry,Manga,Finished,2017-12-07T00:00:00+00:00,7.41,11372,"In a time and place where one's soul can be morphed into a weapon, there are modern-day magicians called Mage-Knights. Although Kurogane Ikki is a student at an institution that trains Mage-Knights, he has no particular talent in magic and is labeled the ""Failure Knight"" or ""Worst One."" Getting way less than average marks in the scorings, he was forced to repeat a year. But with the arrival of a new head of the institution, a new rule was created: knights whose abilities are compatible, as decided by the board, must share rooms and attend practice and training together throughout their school years to bring up their abilities to the max. It is a rule to implement the absolute verdict of ability.

Ikki's roommate, Stella Vermillion, turns out to be a princess of another foreign country. Stella is a Rank A knight: the type of genius in magic who only appears once a decade. When Ikki walked in on her while she was changing her clothes, it caused a huge misunderstanding, which eventually ended up in a duel between the two of them. The punishment for the losing side is Eternal Submission to the winning side.

Forced to live the same room and practice magic together throughout all their school years, how will Stella and Ikki's relationship evolve?

(Source: Baka-Tsuki)"
110050,Boku no Kanojo wa Saikou desu!,Manga,Finished,2019-05-09T00:00:00+00:00,7.15,7616,"A boy is disheartened after being suddenly dumped by his girlfriend. Wanting to cheer him up, his tomboyish friend proposes the unexpected: they should start dating instead! Because of their starkly contrasting personalities, the new couple often engages in silly arguments and lengthy banter. From celebrating Christmas to simply resting at home, their daily life together never fails to be romantic as well as entertaining!

[Written by MAL Rewrite]"
143031,Aishiteru Game wo Owarasetai,Manga,Publishing,,8.01,8784,"In sixth grade, childhood friends Yukiya Asagi and Miku Sakura created a game with the objective to embarrass the other person by taking turns saying ""I love you."" Four years later, even as they are entering high school, the two are still trying to one-up the other and claim victory. However, as tender feelings begin to bloom in their hearts, the simple phrase has taken on new meaning beyond the rules of their game.

With the passing of each day, the urge to become more than childhood friends grows—but both Yukiya and Miku resist making the first move, hesitant about what is in store once the game finally ends.

[Written by MAL Rewrite]"
87813,Takane to Hana,Manga,Finished,2020-07-20T00:00:00+00:00,7.88,9271,"Sixteen-year-old Hana Nonomura is forced to be the substitute for her older sister Yukari at a miai: a meeting between two people considering an arranged marriage. Hana's prospective suitor turns out to be the handsome heir of the wealthy Takaba company, Takane Saibara, who is 10 years her senior. He promptly shows disdain toward Hana and, in response, she tells him that she is equally unimpressed by his status and personality.

Hana believes that her actions at the meeting should have put an end to the discussions about marriage with Takane. To her surprise, not only does the man want to proceed with negotiations but he also starts to show interest in her! This is just the beginning of a special relationship between two polar opposites!

[Written by MAL Rewrite]"
73,Tenjou Tenge,Manga,Finished,2010-08-19T00:00:00+00:00,7.23,12534,"In one unusual Tokyo high school, education takes a backseat to brawling as warring clubs wreak havoc in the hallways and chaos in the classrooms, all vying to be the baddest team around! Although they often contribute their fair share, only a handful of students serve to stem the tide of violence in this untamed outpost. These are the few, the proud, the powerful: the members of the Juken Club!

(Source: CMX)"
113169,"Maou no Ore ga Dorei Elf wo Yome ni Shitanda ga, Dou Medereba Ii?",Manga,Publishing,,7.57,8961,"With an aloof demeanor, intimidating appearance, and tremendous power, Zagan the mage is seen as an evil sorcerer and feared by all around him. As he goes about his daily routine of studying magic and punishing any ruffians he comes across, he accepts an invitation to a mysterious auction featuring various items of a late Archdemon.

There, he is surprised to find Nephelia, a white-haired elf slave, as the main prize of the auction. Mesmerized by her beauty, he instantly falls in love and spends a fortune purchasing her without a second thought. However, due to his awkward manners and social ineptitude, he finds it difficult to express his feelings for her.

As the eccentric duo embark on a new journey together, Zagan and Nephelia learn to be more earnest with each other, forming a relationship that gradually grows to be more romantic.

[Written by MAL Rewrite]"
94,D.N.Angel,Manga,Finished,2021-01-22T00:00:00+00:00,7.42,13843,"Daisuke Niwa is an ordinary, if slightly unlucky, middle school student. On his fourteenth birthday, he comes down with a ""condition"" that has plagued the men in his family for three hundred years. When he sees his crush, Risa, he transforms into his alter ego, the phantom thief Dark Mousy. Unfortunately, when Dark Mousy sees his crush, Risa's twin Riku, he transforms back into Daisuke. The only cure for this craziness is if Daisuke can get Risa to fall in love with him...

(Source: Tokyopop)

Included one-shots:
Volume 1: Namaiki no 'N' (""N"" is for Nishiki)
Volume 2: OumagaAGAIN (The Demon Returns)
Volume 4: Kanno-ke wa Kanai Anzen. (Protecting the Kanno House)"
